### ISSUE TITLE
Websocket "BrokenPipe" panic

### ISSUE THREAD

**Issue by matt-walker0** [snapview/tungstenite-rs#305]
Hi,

Stumbled upon an issue writing websocket data to [Grafana](https://grafana.com/docs/grafana/latest/setup-grafana/set-up-grafana-live/) where write_message() panics with a IO error [below]. This seems to occur after ~28sec everytime, where prior to this everything works perfectly, writing a test sine wave onto a dashboard. The Python implementation of websockets doesn't have this issue, currently running for 2 hrs without issue. I feel that this maybe keep-alive related but that's about the limit of my knowledge! I've tried to slow/speed up data write rates, wrap write_msg() in can_write(), calling write_pending() all to no avail. Any ideas what could cause this on tungstenite, and how to fix? 

Cheers all.

**Code**
```
`  let mut request = "ws://localhost:3000/api/live/push/sinewave".into_client_request()?;
    request.headers_mut().append(http::header::AUTHORIZATION, "Bearer SomeAPIKey=".parse().unwrap());

    let (mut socket, response) = connect(request).unwrap(); 


    let mut i: f32 = 0.0;
            
    loop {

        let sine = i.to_radians().sin();
        let now = SystemTime::now();
        let since_the_epoch = now
            .duration_since(UNIX_EPOCH)
            .expect("Time went backwards");

        let json_out = format!("test sinewave={} {}", sine, since_the_epoch.as_nanos());

        println!("{}", json_out);

        socket.write_message(Message::Text(json_out)).unwrap();
              

        if i == 360.0 {
            i = 0.0;
        } else {
            i += 1.0;
        }

        thread::sleep( Duration::from_millis(50));    
    }`
```

**Env**
Grafana running localhost in docker container. Working with Python.

**Error**
```
thread 'main' panicked at 'called `Result::unwrap()` on an `Err` value: Io(Os { code: 32, kind: BrokenPipe, message: "Broken pipe" })', src/websock.rs:43:59
note: run with `RUST_BACKTRACE=1` environment variable to display a backtrace
```

**Comment by agalakhov** [comment]
You're using `unwrap()`. This means, you've explicitly written that you want your program to crash in case of _any_ error.

"Broken pipe" means just sudden network disconnect for any reason. Network disconnects are quite usual and can't be avoided. It's up to you to decide what to do, i.e. report the error to the user or try to reconnect. In any case do proper error handling. Using `unwrap()` everywhere is just asking for trouble.

**Comment by matt-walker0** [comment]
@agalakhov Understood, and thanks for the reply.
I can indeed reconnect, and admittedly with beginner level code I can catch the error and reconnect to web socket, preventing a interruption to the stream. 
Larger point behind this is trying to understand why a web socket is dropped over a localhost connection, when same data sent by Python websockets library does not drop _(unless Python is silently reconnecting)_. Below is output from where connection is reestablioshed, note that the interval between each drop is exactly 28 seconds... Is there some sort of timeout that I'm missing?

```
Websocket broke and reconnected at 1664566760 (Unix timestamp)

Websocket broke and reconnected at 1664566788 (Unix timestamp)

Websocket broke and reconnected at 1664566816 (Unix timestamp)

Websocket broke and reconnected at 1664566844 (Unix timestamp)

Websocket broke and reconnected at 1664566872 (Unix timestamp)

Websocket broke and reconnected at 1664566900 (Unix timestamp)

Websocket broke and reconnected at 1664566928 (Unix timestamp)

Websocket broke and reconnected at 1664566956 (Unix timestamp)
....
```

**Comment by matt-walker0** [comment]
Further edit:
Looking at TCP dump output of Python vs Tungstenite the latter seems to be using two ports to "push" to Grafana on 3000. Grafana will then raise a F(inish?) flag. In Python only one port "pushes" to Grafana and F flag is never raised.

**Comment by agalakhov** [comment]
Tungstenite never opens any ports on its own. Two ports mean that your code somehow manages to open the connection twice. In general, you get one open port per one `connect()` call. This could be either if the whole thread is started twice or if your reconnect code reconnects too early before the connection is actually gone. I believe there is something wrong with the reconnect code.

Most likely the problem is caused by some incorrect data pushed from the Rust side or by pushing the data too rarely or too often. Check error logs at Grafana side, probably it forces the disconnect due to wrong client behavior. There are many possible reasons for errors, look at [corresponding Grafana docs](https://grafana.com/docs/grafana/v9.0/setup-grafana/set-up-grafana-live/#max-number-of-connections). If Grafana forces the connection to close prematurely, you'll get "Broken pipe" or "Connection reset by peer" error for writing and reading correspondingly. Both mean in fact the same. There is no real way to tell if the server _doesn't want_ to talk (your client is banned) or if it _can't_ talk (something in between interrupts the connection, like a firewall or a broken cable). But if it happens on `localhost` with no firewall, then the server not wanting to talk is the only reason.

**Comment by matt-walker0** [comment]
Not too sure whats going on with the two port communications, Python seems to do it to on second look. Does indeed look like server doesn't want to talk, rather than packets getting lost.
I've tried to make two identical scripts to demonstrate the deviation in behavior, both scripts below send exactly same string, sinewave at 50ms intervals. Still the rust one panics (understandably due to no recovery in snippet below), whilst the Python doesn't error at all.

Python code, outputting a string representation of sinewave (50ms refresh). No TCP [F] flag present. 

```
import math
import time
import asyncio
import websockets

async def stream():
	async with websockets.connect("ws://localhost:3000/api/live/push/py_sinewave", 
		extra_headers={'Authorization': 'Bearer ApiKeyABC='}) as websocket:

		i = 0
		while True:
			to_send = "test Sinewave=" + str((math.sin(math.radians(i))+1)*20+80) +" " + str(time.time_ns()+1000000000)
			print(to_send)
			await websocket.send(to_send)
			if (i == 360):
				i = 0
			else:
				i += 1
			await asyncio.sleep(0.05)

asyncio.run(stream())
```
TCP dump Python:
```
 00:00:00.000051 IP localhost.32908 > localhost.3000: Flags [.], ack 34733, win 9207, options [nop,nop,TS val 3842350495 ecr 3842350494], length 0
 00:00:00.049948 IP localhost.41912 > localhost.3000: Flags [P.], seq 14915:14972, ack 1, win 512, options [nop,nop,TS val 3842350544 ecr 3842350494], length 57
 00:00:00.000043 IP localhost.3000 > localhost.41912: Flags [.], ack 14972, win 512, options [nop,nop,TS val 3842350545 ecr 3842350544], length 0
 00:00:00.000172 IP localhost.3000 > localhost.32908: Flags [P.], seq 34733:34866, ack 7, win 512, options [nop,nop,TS val 3842350545 ecr 3842350495], length 133
```


Rust code, same as above 50ms and string representing sine wave,

```
pub fn test() -> Result<u32, tungstenite::Error> {


    let mut grafana_req: Request<()> = "ws://localhost:3000/api/live/push/rust_sinewave".into_client_request().unwrap();
    grafana_req.headers_mut().append(http::header::AUTHORIZATION, "Bearer ApiKeyABC=".parse().unwrap());

    let (mut socket, mut response) = connect(grafana_req).unwrap(); 


    let mut i: f32 = 0.0;
            
    loop {

        let sine = i.to_radians().sin();
        let now = SystemTime::now();
        let since_the_epoch = now
            .duration_since(UNIX_EPOCH)
            .expect("Time went backwards");

        let json_out = format!("test Sinewave={} {}", sine, since_the_epoch.as_nanos());

        socket.write_message(Message::Text(json_out)).unwrap(); // This will panic if write fails.
        
        if i == 360.0 {
            i = 0.0;
        } else {
            i += 1.0;
        }

        thread::sleep(Duration::from_millis(50));    
    }
    // socket.close(None);
}
```

TCP dump rust (note the F. flag which causes broken pipe):
```

 00:00:00.000035 IP localhost.3000 > localhost.54238: Flags [.], ack 27879, win 512, options [nop,nop,TS val 3842552276 ecr 3842552276], length 0
 00:00:00.000154 IP localhost.3000 > localhost.34516: Flags [P.], seq 59827:59954, ack 948, win 512, options [nop,nop,TS val 3842552276 ecr 3842552226], length 127
 00:00:00.000036 IP localhost.34516 > localhost.3000: Flags [.], ack 59954, win 512, options [nop,nop,TS val 3842552276 ecr 3842552276], length 0
 00:00:00.049900 IP localhost.54238 > localhost.3000: Flags [P.], seq 27879:27930, ack 132, win 512, options [nop,nop,TS val 3842552326 ecr 3842552276], length 51
 00:00:00.000043 IP localhost.3000 > localhost.54238: Flags [.], ack 27930, win 512, options [nop,nop,TS val 3842552326 ecr 3842552326], length 0
 00:00:00.000193 IP localhost.3000 > localhost.34516: Flags [P.], seq 59954:60081, ack 948, win 512, options [nop,nop,TS val 3842552326 ecr 3842552276], length 127
 00:00:00.000040 IP localhost.34516 > localhost.3000: Flags [.], ack 60081, win 512, options [nop,nop,TS val 3842552326 ecr 3842552326], length 0
 00:00:00.005121 IP localhost.3000 > localhost.54238: Flags [F.], seq 132, ack 27930, win 512, options [nop,nop,TS val 3842552331 ecr 3842552326], length 0
 00:00:00.041497 IP localhost.54238 > localhost.3000: Flags [.], ack 133, win 512, options [nop,nop,TS val 3842552373 ecr 3842552331], length 0
 00:00:00.003234 IP localhost.54238 > localhost.3000: Flags [P.], seq 27930:27980, ack 133, win 512, options [nop,nop,TS val 3842552376 ecr 3842552331], length 50
```

**Comment by agalakhov** [comment]
Now I see. You aren't calling `read_message()` at all. WebSocket is bidirectional so even if you only want to write, you still must read and discard. And, in case of Tungstenite, you must handle possible error values returned by `read_message()`. You may switch the socket to non-blocking mode if you don't want `read_message()` to block. `write_message()` never blocks.

**Comment by matt-walker0** [comment]
@agalakhov  Getting there, thanks a bunch.
I've now changed code to [below] doesn't seem to hit I/O broken pipe but now takes 5-10seconds to write a single message.

```
        socket.write_message(Message::Text(json_out)).unwrap(); // This will panic if write fails.
        socket.read_message().no_block().unwrap(); // This will panic if write fails.
        println!("Sent!");
```

**Comment by agalakhov** [comment]
Your socket is still in blocking mode. The fact it doesn't block infinitely means that, indeed, there are incoming messages. The function `no_block()` you're calling does not switch anything to non-blocking mode, it is just for error handling in non-blocking mode. You need to call `[set_nonblocking](https://doc.rust-lang.org/std/net/struct.TcpStream.html#method.set_nonblocking)` of the underlying `TcpStream`, use `get_mut()` to get access to it.

**Comment by matt-walker0** [comment]
Sorted! Thanks for the help, apologies for my basic understanding atm.

For any others who are doing the same thing, example code below pushes Sinewave to websocket in format Grafana Live can decode. Nonblocking mode is a must, I presume without reading Grafana terminates connection itself which was causing issues above. 

```
    // Setup websocket request, appending API key.
    let mut grafana_req: tungstenite::http::Request<()> = "ws://localhost:3000/api/live/push/rust_sinewave".into_client_request().unwrap();
    grafana_req.headers_mut().append(http::header::AUTHORIZATION, "Bearer APIkeyABC=".parse().unwrap());

    // Connecto to websocket
    let (mut socket, _) = connect(grafana_req).unwrap(); 

    // Set to nonblocking mode.
    match socket.get_mut() {
        tungstenite::stream::MaybeTlsStream::Plain(s) => {
            s.set_nonblocking(true).expect("Failed to set none blocking");
        }
        _ => println!("Expected plain TCP"),

    }

    let mut i: f32 = 0.0;
            
    // Push sinewave onto Grafana via websocket connection.
    loop {
        let sine = i.to_radians().sin();
        let now = SystemTime::now();
        let since_the_epoch = now
            .duration_since(UNIX_EPOCH)
            .expect("Time went backwards");

        let json_out = format!("test Sinewave={} {}", sine, since_the_epoch.as_nanos());

        socket.write_message(Message::Text(json_out)).unwrap(); // This will panic if write fails.

        _ = socket.read_message(); // Ignore any errors with read. Only here to prevent websock timeout.
        
        if i == 360.0 {
            i = 0.0;
        } else {
            i += 1.0;
        }
        thread::sleep(Duration::from_millis(50));    
    }
```

_Code will panic something goes wrong, only useful for example._

**Comment by agalakhov** [comment]
Both `TlsStream` and `StreamOwned` have `get_mut()` as well, you can switch them to non-blocking mode too.
